<?xml version="1.0" encoding="UTF-8"?>
<Versieoverzicht xmlns="https://standaarden.overheid.nl/stop/imop/schemata/"
                 xmlns:xsi="http://www.w3.org/2001/XMLSchema-instance"
                 schemaversie="1.3.0-ic"
                 xsi:schemaLocation="https://standaarden.overheid.nl/stop/imop/schemata/   https://standaarden.overheid.nl/stop/1.4.0-ic/imop-schemata.xsd">
  <versie>1.3.0-ic</versie>
  <Module>
    <localName>AanleveringBesluit</localName>
    <namespace>https://standaarden.overheid.nl/lvbb/stop/aanlevering/</namespace>
    <implementatie>
      <Moduleversie>
        <introductieversie>1.0.0</introductieversie>
        <schema>https://standaarden.overheid.nl/lvbb/1.3.0-ic/lvbb-stop-aanlevering.xsd</schema>
        <schematron>https://standaarden.overheid.nl/lvbb/1.3.0-ic/lvbb-aanlevering.sch</schematron>
      </Moduleversie>
    </implementatie>
  </Module>
  <Module>
    <localName>AanleveringKennisgeving</localName>
    <namespace>https://standaarden.overheid.nl/lvbb/stop/aanlevering/</namespace>
    <implementatie>
      <Moduleversie>
        <introductieversie>1.0.0</introductieversie>
        <schema>https://standaarden.overheid.nl/lvbb/1.3.0-ic/lvbb-stop-aanlevering.xsd</schema>
        <schematron>https://standaarden.overheid.nl/lvbb/1.3.0-ic/lvbb-aanlevering.sch</schematron>
      </Moduleversie>
    </implementatie>
  </Module>
  <Module>
    <localName>AanleveringInformatieObject</localName>
    <namespace>https://standaarden.overheid.nl/lvbb/stop/aanlevering/</namespace>
    <implementatie>
      <Moduleversie>
        <introductieversie>1.0.0</introductieversie>
        <schema>https://standaarden.overheid.nl/lvbb/1.3.0-ic/lvbb-stop-aanlevering.xsd</schema>
        <schematron>https://standaarden.overheid.nl/lvbb/1.3.0-ic/lvbb-aanlevering-io.sch</schematron>
      </Moduleversie>
    </implementatie>
  </Module>
  <Module>
    <localName>AanleveringRevisie</localName>
    <namespace>https://standaarden.overheid.nl/lvbb/stop/aanlevering/</namespace>
    <implementatie>
      <Moduleversie>
        <introductieversie>1.3.0-ic</introductieversie>
        <schema>https://standaarden.overheid.nl/lvbb/1.3.0-ic/lvbb-stop-aanlevering.xsd</schema>
      </Moduleversie>
    </implementatie>
  </Module>
  <Module>
    <localName>AanleveringRectificatie</localName>
    <namespace>https://standaarden.overheid.nl/lvbb/stop/aanlevering/</namespace>
    <implementatie>
      <Moduleversie>
        <introductieversie>1.3.0-ic</introductieversie>
        <schema>https://standaarden.overheid.nl/lvbb/1.3.0-ic/lvbb-stop-aanlevering.xsd</schema>
      </Moduleversie>
    </implementatie>
  </Module> 
  <Module>
    <localName>AanleveringMededeling</localName>
    <namespace>https://standaarden.overheid.nl/lvbb/stop/aanlevering/</namespace>
    <implementatie>
      <Moduleversie>
        <introductieversie>1.3.0-ic</introductieversie>
        <schema>https://standaarden.overheid.nl/lvbb/1.3.0-ic/lvbb-stop-aanlevering.xsd</schema>
      </Moduleversie>
    </implementatie>
  </Module>   
  <Module>
    <localName>validatieOpdracht</localName>
    <namespace>http://www.overheid.nl/2017/lvbb</namespace>
    <implementatie>
      <Moduleversie>
        <introductieversie>1.0.0</introductieversie>
        <schema>https://standaarden.overheid.nl/lvbb/1.3.0-ic/lvbb-transport.xsd</schema>
      </Moduleversie>
    </implementatie>
  </Module>
  <Module>
    <localName>publicatieOpdracht</localName>
    <namespace>http://www.overheid.nl/2017/lvbb</namespace>
    <implementatie>
      <Moduleversie>
        <introductieversie>1.0.0</introductieversie>
        <schema>https://standaarden.overheid.nl/lvbb/1.3.0-ic/lvbb-transport.xsd</schema>
      </Moduleversie>
    </implementatie>
  </Module>
  <Module>
    <localName>validatieDirecteMutatieOpdracht</localName>
    <namespace>http://www.overheid.nl/2017/lvbb</namespace>
    <implementatie>
      <Moduleversie>
        <introductieversie>1.0.0</introductieversie>
        <schema>https://standaarden.overheid.nl/lvbb/1.3.0-ic/lvbb-transport.xsd</schema>
      </Moduleversie>
    </implementatie>
  </Module>
  <Module>
    <localName>directeMutatieOpdracht</localName>
    <namespace>http://www.overheid.nl/2017/lvbb</namespace>
    <implementatie>
      <Moduleversie>
        <introductieversie>1.0.0</introductieversie>
        <schema>https://standaarden.overheid.nl/lvbb/1.3.0-ic/lvbb-transport.xsd</schema>
      </Moduleversie>
    </implementatie>
  </Module>
  <Module>
    <localName>breekPublicatieAfOpdracht</localName>
    <namespace>http://www.overheid.nl/2017/lvbb</namespace>
    <implementatie>
      <Moduleversie>
        <introductieversie>1.0.0</introductieversie>
        <schema>https://standaarden.overheid.nl/lvbb/1.3.0-ic/lvbb-transport.xsd</schema>
      </Moduleversie>
    </implementatie>
  </Module>
  <Module>
    <localName>revisieOpdracht</localName>
    <namespace>http://www.overheid.nl/2017/lvbb</namespace>
    <implementatie>
      <Moduleversie>
        <introductieversie>1.3.0-ic</introductieversie>
        <schema>https://standaarden.overheid.nl/lvbb/1.3.0-ic/lvbb-transport.xsd</schema>
      </Moduleversie>
    </implementatie>
  </Module>  
  <Module>
    <localName>manifest</localName>
    <namespace>http://www.overheid.nl/2017/lvbb</namespace>
    <implementatie>
      <Moduleversie>
        <introductieversie>1.0.0</introductieversie>
        <schema>https://standaarden.overheid.nl/lvbb/1.3.0-ic/lvbb-transport.xsd</schema>
      </Moduleversie>
    </implementatie>
  </Module>
</Versieoverzicht>