<?xml version="1.0" encoding="UTF-8"?>
<Versieoverzicht xmlns="https://standaarden.overheid.nl/stop/imop/schemata/"
                 xmlns:xsi="http://www.w3.org/2001/XMLSchema-instance"
                 schemaversie="2.0.0-rc"
                 xsi:schemaLocation="https://standaarden.overheid.nl/stop/imop/schemata/   https://raw.githubusercontent.com/RicharddeGraaf1/schemaTestsRichard/refs/heads/main/1.3/stop/1.3.0/imop-schemata.xsd">
  <versie>2.0.0-rc</versie>
  <Module>
    <localName>AanleveringBesluit</localName>
    <namespace>https://standaarden.overheid.nl/lvbb/stop/aanlevering/</namespace>
    <implementatie>
      <Moduleversie>
        <introductieversie>1.0.0</introductieversie>
        <schema>https://raw.githubusercontent.com/RicharddeGraaf1/schemaTestsRichard/refs/heads/main/1.3/lvbb-stop-aanlevering.xsd</schema>
        <schematron>https://raw.githubusercontent.com/RicharddeGraaf1/schemaTestsRichard/refs/heads/main/1.3/lvbb-aanlevering.sch</schematron>
      </Moduleversie>
    </implementatie>
  </Module>
  <Module>
    <localName>AanleveringKennisgeving</localName>
    <namespace>https://standaarden.overheid.nl/lvbb/stop/aanlevering/</namespace>
    <implementatie>
      <Moduleversie>
        <introductieversie>1.0.0</introductieversie>
        <schema>https://raw.githubusercontent.com/RicharddeGraaf1/schemaTestsRichard/refs/heads/main/1.3/lvbb-stop-aanlevering.xsd</schema>
        <schematron>https://raw.githubusercontent.com/RicharddeGraaf1/schemaTestsRichard/refs/heads/main/1.3/lvbb-aanlevering.sch</schematron>
      </Moduleversie>
    </implementatie>
  </Module>
  <Module>
    <localName>AanleveringInformatieObject</localName>
    <namespace>https://standaarden.overheid.nl/lvbb/stop/aanlevering/</namespace>
    <implementatie>
      <Moduleversie>
        <introductieversie>1.0.0</introductieversie>
        <schema>https://raw.githubusercontent.com/RicharddeGraaf1/schemaTestsRichard/refs/heads/main/1.3/lvbb-stop-aanlevering.xsd</schema>
        <schematron>https://raw.githubusercontent.com/RicharddeGraaf1/schemaTestsRichard/refs/heads/main/1.3/lvbb-aanlevering-io.sch</schematron>
      </Moduleversie>
    </implementatie>
  </Module>
  <Module>
    <localName>validatieOpdracht</localName>
    <namespace>http://www.overheid.nl/2017/lvbb</namespace>
    <implementatie>
      <Moduleversie>
        <introductieversie>1.0.0</introductieversie>
        <schema>https://raw.githubusercontent.com/RicharddeGraaf1/schemaTestsRichard/refs/heads/main/1.3/lvbb-transport.xsd</schema>
      </Moduleversie>
    </implementatie>
  </Module>
  <Module>
    <localName>publicatieOpdracht</localName>
    <namespace>http://www.overheid.nl/2017/lvbb</namespace>
    <implementatie>
      <Moduleversie>
        <introductieversie>1.0.0</introductieversie>
        <schema>https://raw.githubusercontent.com/RicharddeGraaf1/schemaTestsRichard/refs/heads/main/1.3/lvbb-transport.xsd</schema>
      </Moduleversie>
    </implementatie>
  </Module>
  <Module>
    <localName>validatieDirecteMutatieOpdracht</localName>
    <namespace>http://www.overheid.nl/2017/lvbb</namespace>
    <implementatie>
      <Moduleversie>
        <introductieversie>1.0.0</introductieversie>
        <schema>https://raw.githubusercontent.com/RicharddeGraaf1/schemaTestsRichard/refs/heads/main/1.3/lvbb-transport.xsd</schema>
      </Moduleversie>
    </implementatie>
  </Module>
  <Module>
    <localName>directeMutatieOpdracht</localName>
    <namespace>http://www.overheid.nl/2017/lvbb</namespace>
    <implementatie>
      <Moduleversie>
        <introductieversie>1.0.0</introductieversie>
        <schema>https://raw.githubusercontent.com/RicharddeGraaf1/schemaTestsRichard/refs/heads/main/1.3/lvbb-transport.xsd</schema>
      </Moduleversie>
    </implementatie>
  </Module>
  <Module>
    <localName>raadpleegOpdracht</localName>
    <namespace>http://www.overheid.nl/2017/lvbb</namespace>
    <implementatie>
      <Moduleversie>
        <introductieversie>1.0.0</introductieversie>
        <schema>https://raw.githubusercontent.com/RicharddeGraaf1/schemaTestsRichard/refs/heads/main/1.3/lvbb-transport.xsd</schema>
      </Moduleversie>
    </implementatie>
  </Module>
  <Module>
    <localName>breekPublicatieAfOpdracht</localName>
    <namespace>http://www.overheid.nl/2017/lvbb</namespace>
    <implementatie>
      <Moduleversie>
        <introductieversie>1.0.0</introductieversie>
        <schema>https://raw.githubusercontent.com/RicharddeGraaf1/schemaTestsRichard/refs/heads/main/1.3/lvbb-transport.xsd</schema>
      </Moduleversie>
    </implementatie>
  </Module>
  <Module>
    <localName>manifest</localName>
    <namespace>http://www.overheid.nl/2017/lvbb</namespace>
    <implementatie>
      <Moduleversie>
        <introductieversie>1.0.0</introductieversie>
        <schema>https://raw.githubusercontent.com/RicharddeGraaf1/schemaTestsRichard/refs/heads/main/1.3/lvbb-transport.xsd</schema>
      </Moduleversie>
    </implementatie>
  </Module>
</Versieoverzicht>