<?xml version="1.0" encoding="UTF-8"?>
<Versieoverzicht xmlns="https://standaarden.overheid.nl/stop/imop/schemata/"
                 xmlns:xsi="http://www.w3.org/2001/XMLSchema-instance"
                 schemaversie="2.0.0-rc"
                 xsi:schemaLocation="https://standaarden.overheid.nl/stop/imop/schemata/   https://standaarden.overheid.nl/stop/2.0.0-rc/imop-schemata.xsd">
  <versie>1.6.0</versie>
  <Module>
    <localName>Consolidaties</localName>
    <namespace>https://standaarden.overheid.nl/lvbb/stop/uitlevering/</namespace>
    <implementatie>
      <Moduleversie>
        <introductieversie>1.0.0</introductieversie>
        <schema>https://raw.githubusercontent.com/RicharddeGraaf1/schemaTestsRichard/main/lvbb-ozon/lvbb-stop-uitlevering.xsd</schema>
      </Moduleversie>
    </implementatie>
  </Module>
  <Module>
    <localName>OfficielePublicatie</localName>
    <namespace>https://standaarden.overheid.nl/lvbb/stop/uitlevering/</namespace>
    <implementatie>
      <Moduleversie>
        <introductieversie>1.0.0</introductieversie>
        <schema>https://raw.githubusercontent.com/RicharddeGraaf1/schemaTestsRichard/main/lvbb-ozon/lvbb-stop-uitlevering.xsd</schema>
      </Moduleversie>
    </implementatie>
  </Module>
  <Module>
    <localName>UitleveringProefversieBesluit</localName>
    <namespace>https://standaarden.overheid.nl/lvbb/stop/uitlevering/</namespace>
    <implementatie>
      <Moduleversie>
        <introductieversie>1.0.0</introductieversie>
        <schema>https://raw.githubusercontent.com/RicharddeGraaf1/schemaTestsRichard/main/lvbb-ozon/lvbb-stop-uitlevering.xsd</schema>
      </Moduleversie>
    </implementatie>
  </Module>
  <Module>
    <localName>WettechnischeInformatie</localName>
    <namespace>https://standaarden.overheid.nl/lvbb/stop/uitlevering/</namespace>
    <implementatie>
      <Moduleversie>
        <introductieversie>1.0.0</introductieversie>
        <schema>https://raw.githubusercontent.com/RicharddeGraaf1/schemaTestsRichard/main/lvbb-ozon/lvbb-stop-uitlevering.xsd</schema>
      </Moduleversie>
    </implementatie>
  </Module>
  <Module>
    <localName>Vergunning</localName>
    <namespace>https://standaarden.overheid.nl/lvbb/vergunningsmetadata/</namespace>
    <implementatie>
      <Moduleversie>
        <introductieversie>1.0.0</introductieversie>
        <schema>https://standaarden.overheid.nl/lvbb/1.0.0/lvbb-vergunningsmetadata.xsd</schema>
      </Moduleversie>
    </implementatie>
  </Module>
</Versieoverzicht>